id,Заголовок,Текст,Время
40,enim quo cumque,"ut voluptatum aliquid illo tenetur nemo sequi quo facilis
ipsum rem optio mollitia quas
voluptatem eum voluptas qui
unde omnis voluptatem iure quasi maxime voluptas nam","09/12/2023, 10:49"
99,temporibus sit alias delectus eligendi possimus magni,"quo deleniti praesentium dicta non quod
aut est molestias
molestias et officia quis nihil
itaque dolorem quia","09/12/2023, 10:51"
3,ea molestias quasi exercitationem repellat qui ipsa sit aut,"et iusto sed quo iure
voluptatem occaecati omnis eligendi aut ad
voluptatem doloribus vel accusantium quis pariatur
molestiae porro eius odio et labore et velit aut","09/12/2023, 10:54"
